product_id,name,image,description,price
1,quasi,https://placekitten.com/630/216,Laboriosam et sapiente ea vitae voluptatem repellat id.,78
2,voluptatem,https://picsum.photos/259/382,Commodi in est architecto quidem aliquid suscipit.,7
3,corrupti,https://picsum.photos/555/534,Quasi possimus inventore ducimus officia atque tenetur.,86
4,eos,https://dummyimage.com/827x104,Numquam officia laudantium nesciunt doloribus eligendi.,28
5,consequuntur,https://dummyimage.com/552x896,Sit ea magni minus dolores alias ullam.,30
6,ipsa,https://dummyimage.com/406x510,Illo molestias tempore vitae tempore accusantium blanditiis provident.,60
