product_id,name,image,description,price
1,esse,https://picsum.photos/530/580,Consequuntur esse reprehenderit maxime deleniti cupiditate necessitatibus.,64
2,delectus,https://picsum.photos/1005/569,Ad molestiae impedit unde.,44
3,officia,https://dummyimage.com/528x918,Sit laborum illum incidunt.,26
4,molestias,https://picsum.photos/69/682,Porro sequi voluptates doloremque perferendis.,13
5,eos,https://picsum.photos/362/214,Repellendus laudantium laborum minus explicabo autem quo ipsum.,48
6,laudantium,https://placekitten.com/173/390,Sint placeat omnis similique quam aperiam adipisci.,45
7,quod,https://picsum.photos/888/337,Ab magni reiciendis aliquid.,78
8,dolor,https://dummyimage.com/52x586,Ut itaque ipsam deserunt illo enim tempore dolorem.,48
9,nulla,https://dummyimage.com/676x519,Ea repellendus est maxime aspernatur blanditiis consequuntur.,36
10,perspiciatis,https://dummyimage.com/775x705,Porro est in doloribus animi veniam.,52
11,ratione,https://placekitten.com/66/273,Rerum provident minima perferendis.,2
12,excepturi,https://placekitten.com/883/415,Dolor quae nisi fugiat optio iusto.,57
13,voluptas,https://dummyimage.com/538x878,Sed alias ut.,88
14,corporis,https://picsum.photos/388/539,Dolorum cumque iusto illum officia.,91
15,quisquam,https://placekitten.com/132/449,Nam numquam repudiandae omnis.,83
16,veritatis,https://picsum.photos/590/745,Exercitationem aliquid fugit neque soluta dolorem sequi in.,36
17,non,https://placekitten.com/477/394,Quidem sapiente odio doloremque tempora.,3
18,unde,https://picsum.photos/33/250,Reiciendis similique repellendus dolore recusandae eos.,48
19,iusto,https://picsum.photos/287/955,Nisi fuga nulla similique perspiciatis tempore.,59
20,quam,https://picsum.photos/586/741,Provident nostrum suscipit.,91
21,delectus,https://placekitten.com/126/698,Voluptate accusamus sed.,4
22,assumenda,https://placekitten.com/777/514,Distinctio aut temporibus sequi reiciendis doloribus.,43
23,quis,https://dummyimage.com/294x45,Nemo laborum laborum.,55
24,labore,https://placekitten.com/694/490,Repellat rerum impedit ipsum.,42
25,deserunt,https://dummyimage.com/777x214,Labore dolore repudiandae.,7
26,culpa,https://dummyimage.com/398x454,Quisquam ducimus placeat laboriosam repellendus expedita.,45
27,deserunt,https://picsum.photos/495/367,Accusantium repudiandae beatae veritatis quo neque.,37
28,repellat,https://placekitten.com/413/947,Quis dignissimos mollitia ad.,48
29,facere,https://picsum.photos/849/675,Ut animi earum rerum.,47
30,non,https://picsum.photos/438/651,Laborum sunt fugit blanditiis quos.,68
31,quia,https://placekitten.com/102/368,Saepe soluta error facere est ex.,63
32,aliquam,https://dummyimage.com/220x510,Eius voluptas molestias molestiae quia eligendi.,82
33,vitae,https://picsum.photos/99/559,Dicta sunt id laborum cum.,81
34,quisquam,https://picsum.photos/127/956,Ut quod quasi ullam necessitatibus.,29
35,suscipit,https://dummyimage.com/213x105,Officia est itaque aspernatur illo ullam.,55
36,porro,https://dummyimage.com/938x518,Numquam ipsa hic architecto dolorum eum a placeat.,2
37,debitis,https://placekitten.com/45/681,Temporibus voluptate cumque dolore adipisci officia sequi.,85
38,expedita,https://dummyimage.com/68x847,Culpa hic harum animi voluptatem.,39
39,fugit,https://picsum.photos/897/758,Ipsam quos aspernatur asperiores.,2
40,officia,https://dummyimage.com/50x279,Magni beatae laborum eum nam nulla possimus.,62
41,explicabo,https://picsum.photos/610/11,Repellendus sed fugiat velit id aperiam.,32
42,dolor,https://dummyimage.com/750x860,Earum perferendis maxime facilis assumenda laboriosam blanditiis.,12
43,numquam,https://picsum.photos/600/679,Nesciunt nulla autem distinctio ipsum.,38
44,ab,https://picsum.photos/194/468,Tempore laboriosam cumque neque possimus.,81
45,velit,https://picsum.photos/517/661,Facilis excepturi ullam dolores tempore.,51
46,quas,https://placekitten.com/811/21,Iusto velit nemo quis.,20
47,eum,https://dummyimage.com/880x787,Est corporis dicta excepturi ad quaerat deserunt.,75
48,natus,https://dummyimage.com/334x544,Repudiandae cumque doloremque ad possimus.,4
49,veritatis,https://placekitten.com/799/780,Temporibus officia occaecati recusandae excepturi quam.,80
50,voluptate,https://dummyimage.com/702x325,Perferendis officiis nemo veniam iste doloribus.,77
51,laborum,https://dummyimage.com/977x918,Nemo recusandae dolore vitae ea facere laudantium officiis.,77
52,occaecati,https://dummyimage.com/653x710,Iure at sunt reprehenderit hic ab aliquid.,16
53,accusantium,https://placekitten.com/812/157,Occaecati reprehenderit magnam similique.,88
54,praesentium,https://picsum.photos/941/813,Laudantium iusto ab facere.,21
55,accusantium,https://dummyimage.com/952x86,Nisi nemo odit maiores porro.,52
56,aliquam,https://placekitten.com/659/600,Reprehenderit consequuntur nam deserunt.,11
57,voluptates,https://dummyimage.com/247x1020,In vel doloremque qui.,46
58,harum,https://picsum.photos/518/65,Iste doloribus quis earum.,65
59,iusto,https://placekitten.com/434/641,Blanditiis est optio a id aperiam dolore blanditiis.,66
60,dolores,https://placekitten.com/97/425,Quis ex numquam blanditiis ullam temporibus laborum.,72
61,ad,https://dummyimage.com/161x449,Aliquid mollitia neque doloribus quia.,85
62,nihil,https://dummyimage.com/605x219,Et eos consequuntur dolor ipsum facilis dicta.,2
63,natus,https://placekitten.com/920/394,Non laborum culpa fuga illo distinctio.,64
64,quae,https://picsum.photos/430/681,Iste laudantium vitae nam tempora.,40
65,magnam,https://placekitten.com/33/662,Recusandae eum sapiente recusandae dicta error.,53
66,soluta,https://placekitten.com/333/45,Odio a asperiores.,97
67,quam,https://placekitten.com/775/860,Voluptatibus porro saepe molestiae minima.,88
68,accusamus,https://dummyimage.com/389x589,Quia porro dignissimos aspernatur magni voluptatem.,4
69,ex,https://picsum.photos/594/135,Voluptate sed praesentium saepe dicta rem.,73
70,natus,https://picsum.photos/122/166,Minima aspernatur autem eum in nam totam.,74
71,quasi,https://dummyimage.com/185x1022,Cum voluptas ex quidem quia sed esse.,69
72,consequatur,https://dummyimage.com/891x646,Ab deserunt labore sint asperiores.,54
73,earum,https://dummyimage.com/58x61,Numquam dicta consequuntur laborum.,84
74,quis,https://picsum.photos/202/242,Dolorum quae laudantium saepe autem.,88
75,illum,https://picsum.photos/338/156,Rem fugit accusantium sed.,24
76,in,https://dummyimage.com/767x553,Praesentium ducimus ducimus aut.,37
